date,product_name,price
2024-09-08,"Pedaços de Frango Asa, Coxinha da Asa, Sobrecoxa e Peito Congelado com Osso Sadia 1Kg",15.99
2024-09-08,Pedaços de Sobrecoxa de Frango Congelado Sadia 1Kg,10.95
2024-09-08,"Picanha Bovina à Vácuo Aprox. 1,5Kg",93.14
2024-09-08,"Picanha Fatiada à Vácuo Carrefour Aprox 1,5 Kg",57.59
2024-09-08,"Filé Mignon à Vácuo Aprox. 2,5 Kg",174.98
2024-09-08,Cordão de Filé Mignon á Vacuo,28.39
2024-09-08,Contra Filé Peça à Vácuo Aprox. 4Kg,177.16
2024-09-08,Alcatra Miolo Peça Vácuo Aprox. 4kg,166.36
2024-09-08,Coxão Duro Moído Carrefour Aproximadamente 500 g,21.24
2024-09-08,Patinho Bovino Carrefour Aproximadamente 1 kg,39.99
2024-09-08,Paleta e Músculo Reserva 600g,16.14
2024-09-08,Bife de Fígado Congelado Swift Aproximadamente 700 g,13.28
2024-09-08,"Cupim Bovino Carrefour Aproximadamente 2,5 Kg",83.23
2024-09-08,"Coca-Cola 1,5 Litros 6 Unidades",54.89
2024-09-08,Fraldinha Pedaço Aprox. 700g,24.77
2024-09-08,Açúcar Refinado União 1kg,4.39
2024-09-08,Arroz Branco Longo-fino Tipo 1 Camil Todo Dia 5Kg,31.99
2024-09-08,Arroz Branco Prato Fino Tipo 1 - 5kg,34.49
2024-09-08,Filé de Peito de Frango Congelado sem Osso Perdigão 1Kg - Sassami,22.79
2024-09-08,Açúcar Refinado Carrefour 1kg,3.99
2024-09-08,"Iogurte Líquido Parcialmente Desnatado Danone Morango 1,25KG",13.99
2024-09-08,"Suco de Laranja Integral Refrigerado Natural One 100% Suco 1,5 Litros",19.99
2024-09-08,Sabão em Pó Omo Lavagem Perfeita 2.2kg,29.99
2024-09-08,Café Torrado e Moído 3 Corações Tradicional  a Vácuo 500g,18.99
2024-09-08,Salmão Inteiro Fresco Aprox. 4Kg,235.56
2024-09-08,Sal Refinado Carrefour 1Kg,2.39
2024-09-08,Petisco Temperado Frango de Padaria 1 Kg,14.99
2024-09-08,Sal Refinado Iodado Branco Lebre 1Kg,2.09
2024-09-08,"Refrigerante Coca-Cola Sem Açúcar 1,5L",8.99
2024-09-08,"Suco de Uva e Maçã Integral Refrigerado Natural One 100% Suco 1,5 Litros",21.99
2024-09-08,Salmão Inteiro Congelado Aprox. 2 kg,89.8
2024-09-08,Areia Higiênica Carrefour 4kg,39.99
2024-09-08,Arroz Branco Longo-fino Tipo 1 Tio João 5 Kg,37.99
2024-09-08,"Maminha Swift Mais Aprox. 1,8Kg",84.56
2024-09-08,Acém Bovino Fracionado à Vácuo 600g,21.23
2024-09-08,"Lagarto Peça à Vácuo Aprox. 3,5Kg",104.96
2024-09-08,"Ossobuco Swift Aproximadamente 1,2 Kg",31.18
2024-09-08,Capa de Filé à Vácuo Aprox. 2 Kg,60.98
2024-09-08,"Lombo Suíno Assa Fácil Swift Aprox. 1,4Kg",44.77
2024-09-08,Picanha Suína Temperada Carrefour Aproximadamente 800 g,23.99
2024-09-08,"Costela Suína Swift Aproximadamente 1,5 Kg",34.47
2024-09-08,Linguiça Calabresa Perdigão 400 g,14.99
2024-09-08,Linguiça Fina De Calabresa Apimentada  Perdigão 400g,22.89
2024-09-08,Bacon Defumado Sadia Aprox. 360g,12.2
2024-09-08,Lombo Suíno Assa Fácil Congelado Sadia Aproximadamente 750 g,18.74
2024-09-08,Lombo Fatiado Especial em Cortes Resfriado Carrefour Aprox. 750g,20.99
2024-09-08,Lombo Canadense Ceratti Aprox. 120g,6.53
2024-09-08,Lombo Defumado Fatiado Aurora Aproximadamente 120 g,6.47
2024-09-08,Lombo Suíno Levissimo Seara Aprox. 200 g,7.65
2024-09-08,Lombo De Pirarucu Swift 300 g,24.98
2024-09-08,Pedaços de Frango Coxinha da Asa Congelada com Osso Sadia 1Kg,16.19
2024-09-08,Pedaços de Sobrecoxa de Frango Congelado Seara 1Kg,14.99
2024-09-08,G Tadalafila 5Mg 30C Omp Ems,16.9
2024-09-08,"Pernil de Cordeiro Uruguai Carrefour Aproximadamente 1,8 Kg",152.98
2024-09-08,G Nimesulida 100Mg 1 2Comp Ems,10.69
2024-09-08,G Losartana 50Mg 30C Omp Med,7.9
2024-09-08,Tiras Reagentes para Medição de Glicose G-Tech Lite com 50 Unidades,49.9
2024-09-08,G Tadalafila 20Mg 4C Omp Ems,14.9
2024-09-08,Linguiça Toscana Swift Fina 500 g,18.98
2024-09-08,Leite Integral Piracanjuba 1 Litro,5.49
2024-09-08,Kit Leite Integral Piracanjuba 1 Litro 6 Unidades,37.39
2024-09-08,Leite Desnatado Piracanjuba 1 Litro,5.49
2024-09-08,Leite Semidesnatado Piracanjuba 1 Litro,5.49
2024-09-08,Leite Em Pó Ninho Integral Lata 380g,20.9
2024-09-08,Kit Leite em Pó Ninho Integral Lata 380g 4 Unidades,91.29
2024-09-08,Manteiga com Sal Président Tablete 200g,12.49
2024-09-08,Manteiga sem Sal Président Tablete 200g,12.49
2024-09-08,Queijo Parmesao President 180g,28.79
2024-09-08,Queijo Parmesão Cilindro Président 180g,27.89
2024-09-08,Queijo Parmesão Président Aprox. 180g,26.99
2024-09-08,Queijo Parmesão Ralado Président 100g,16.59
2024-09-08,Queijo Parmesão Fracionado Tania Aproximadamente 200 g,18.59
2024-09-08,Queijo Provolone Defumado Fracionado Président Aprox 200g,20.61
2024-09-08,Queijo Muçarela Fatiado President 150g,11.59
2024-09-08,Queijo Parmesão Ralado Président 50g,9.39
2024-09-08,Queijo Gruyere President 160g,27.49
2024-09-08,Queijo Parmesão Cilindro Président 180g,28.09
2024-09-08,Queijo Gouda Président 185g,27.49
2024-09-08,Queijo Mussarela Bolinha Búfala Almeida Prado 395 g,29.39
2024-09-08,Queijo Ralado Quatro Queijos Président 100 g,18.49
2024-09-08,Queijo Mussarela Bolinha de Búfala Almeida Prado 250 g,40.89
2024-09-08,Queijo Brie Président Petit 125 g,38.49
2024-09-08,Queijo Estepe President 160g,27.49
2024-09-08,Queijo Maasdam Président 160g,27.49
2024-09-08,Queijo Camembert Peça President 125g,38.49
2024-09-08,Queijo Gorgonzola Igor Dolce 150g,47.89
2024-09-08,Queijo Parmesão Ralado Vigor 100g,10.99
2024-09-08,Queijo Mussarela Tirolez Aprox. 380g,36.02
2024-09-08,Queijo Minas Padrão 500g,36.34
2024-09-08,Queijo Minas Padrão Verde Campo Aproximadamente 500 g,44.99
2024-09-08,Queijo Minas Padrão Tirolez Aproximadamente 500 g,56.95
2024-09-08,Queijo Minas Padrão Vegano de Castanha de Caju Vida Veg 200g,27.09
2024-09-08,Requeijão Cremoso Catupiry 200g,7.59
2024-09-08,Requeijão Cremoso Catupiry Light 200g,7.59
2024-09-08,Requeijão Cremoso Original Catupiry 250g,14.99
2024-09-08,Requeijão Cremoso Catupiry Original Pote 250 g,17.99
2024-09-08,Requeijão Cremoso Alho Poró Catupiry Culinário 250g,18.49
2024-09-08,Requeijão Cremoso Sabor Cheddar Catupiry Culinário 250 g,18.49
2024-09-08,Iogurte Integral Nestlé Tradicional 170g,2.79
2024-09-08,Iogurte Natural Integral Batavo 170g,2.79
2024-09-08,Iogurte Cremoso Integral Natural Batavo 160 g,2.75
2024-09-08,Leite Condensado Semidesnatado MOÇA Caixinha 395g,8.99
2024-09-08,Leite Integral UHT Ninho Forti+ Vitaminado 1 L,6.49
2024-09-08,Leite Condensado Integral Carrefour Classic 395g,6.19
2024-09-08,Leite Semidesnatado UHT Ninho Levinho Vitaminado 1 L,6.49
2024-09-08,Leite Condensado Integral Carrefour Classic 12 Unidades de 395g,77.99
2024-09-08,Leite Semidesnatado UHT Goiasminas Italac 1 Litro,5.49
2024-09-08,Leite Integral UHT Tipo A Shefa 1 Litro,5.39
2024-09-08,Leite Integral Carrefour 1L,4.99
2024-09-08,Coca-Cola Lata 350 ml,2.99
2024-09-08,Leite Fermentado Desnatado Yakult 80g 6 Unidades,9.89
2024-09-08,Leite em Pó Integral La Serenissima 200g,7.99
2024-09-08,Leite Condensado Triângulo Mineiro 395 g,4.79
2024-09-08,Leite UHT Tipo A2A2 Semidesnatado Zero Lactose Piracanjuba 1L,10.49
2024-09-08,Leite UHT Integral Itambé Caixa com Tampa 1 L,5.39
2024-09-08,Leite Integral UHT Quatá 1 Litro Caixa 1 Unidade,4.99
2024-09-08,Leite Condensado Semidesnatado Piracanjuba Caixa 395g,7.99
2024-09-08,Creme de Leite NESTLÉ 200g,4.69
2024-09-08,Creme de Leite UHT Leve Homogeneizado Zero Lactose Nestlé 200g,5.89
2024-09-08,Creme de leite NESTLÉ 300g,8.29
2024-09-08,Creme de Leite NESTLÉ Extra Cremoso 280g,12.49
2024-09-08,Filé de Peito de Frango em Bifes Levemente Temperado Sadia Pcte 1kg,26.99
2024-09-08,Filé de Frango Congelado Sadia Marinados 1Kg,25.89
2024-09-08,Filé de Frango à parmegiana Sadia 500g,22.49
2024-09-08,Filé de Frango Sadia Assa Fácil 700 g,19.99
2024-09-08,Filezinho Peito Frango Congelado Sadia Bio 1 Kg,27.99
2024-09-08,Linguiça Tipo Calabresa Sadia 400g,14.29
2024-09-08,Lingüiça de Calabresa Defumada Sadia Aprox. 500g,15.44
2024-09-08,Linguiça Toscana Grossa Sadia Aprox 5Kg,115.95
2024-09-08,Linguiça Toscana Inteira Sadia Aproximadamente 600 g,14.94
2024-09-08,Linguiça Paio Sadia 370 g,19.69
2024-09-08,Linguiça Defumada Tipo Portuguesa Sadia 400 g,15.29
2024-09-08,Linguiça de Calabresa Defumada Sadia 1 Kg,27.79
2024-09-08,Frango em Cubos Temperados Congelado Sadia 400 g,24.99
2024-09-08,Frango a Passarinho Temperado Sadia 1 Kg,17.29
2024-09-08,Frango Tiras Temperado Congelado Sadia 400 g,24.99
2024-09-08,Linguiça Mista Fininha Sadia 240 g,10.99
2024-09-08,Empanadíssimo de Frango em Tiras Temperado Congelado Sadia Pacote 400g,23.99
2024-09-08,Nuggets de Frango Sadia 700g,27.99
2024-09-08,Coxa de Frango Congelado Sadia 1 Kg,12.99
2024-09-08,Nuggets de Frango Tradicional Sadia 300g,12.99
2024-09-08,Sobrecoxa Temperada Frango Fácil Sadia 800 g,14.99
2024-09-08,Coxa com Sobrecoxa de Frango Sadia Passa.Iqf 1Kg,16.99
2024-09-08,Empanadíssimo de Frango em Tiras de Frango Congelado Sadia Pacote 400g,23.99
2024-09-08,Coração de Frango Congelado Sadia 1 Kg,37.29
2024-09-08,Hambúrguer de Frango Congelado Sadia 12 Unidades,20.99
2024-09-08,Coxinha da Asa Orgânico Congelado Sadia 600 g,36.99
2024-09-08,"Pizza Congelada Sadia Frango com Requeijão e Mussarela 460g +Coca-Cola Sem Açúcar 1,5L",21.74
2024-09-08,Coxa com Sobrecoxasadia Bio 1 Kg,25.99
2024-09-08,Coxinhas das Asas Empanadas Sadia 400g,18.99
2024-09-08,"Picanha Bovina Congelada Aprox 1,6Kg",86.38
2024-09-08,Picanha Suína Congelado Seara Assa Fácil Aproximadamente 800 g,16.79
2024-09-08,"Picanha Ouro Congelada Swift 1,1Kg",98.98
2024-09-08,Picanha Suína Temperada Churrasco Seara Aprox. 850g,33.9
2024-09-08,"Picanha Bovina Cry Carrefour Aprox. 1,5 Kg",77.09
2024-09-08,"Picanha Prata Congelada Swift Aproximadamente 1,2 Kg",87.58
2024-09-08,Picanha Selection 1 Kg,109.9
2024-09-08,Picanha Bovina Congelada Swift Mais Aproximadamente 1500g,109.47
2024-09-08,Picanha Carapreta Resfriado Aproximadamente 1400g,237.86
2024-09-08,Picanha de Cordeiro Resfriada Aproximadamente 300g,31.47
2024-09-08,Picanha Suína Assa Fácil Swift Aprox. 800g,27.11
2024-09-08,Hambúrguer Picanha Sadia 145g,8.39
2024-09-08,Salgadinho de Trigo Picanha Elma Chips Pingo d'Ouro Clássicos 55g,5.09
2024-09-08,Hambúrgue de Picanha Congelado Perdigao Na Brasa com 2 Unidades 300g,15.99
2024-09-08,Salgadinho de Trigo Picanha Elma Chips Pingo d'Ouro Clássicos 120g,10.49
2024-09-08,"Alcatra de Cordeiro Picanha Ovina Congelada Swift Aproximadamente 1,1 Kg",104.48
2024-09-08,Hambúrguer de Picanha Congelado Wessel 400g 2 Unidades,29.39
2024-09-08,Bife de Picanha Bovina Carrefour Aproximadamente 600 g,34.61
2024-09-08,Pinha Fresco Inteiro Carrefour Aproximadamente 600 g,23.94
2024-09-08,Cebola Picante Fugita 400 g,8.99
2024-09-08,Pão de Alho Picante Zinho 300g,8.99
2024-09-08,Sabonete Líquido Harrop Pitanga com 1 L,14.9
2024-09-08,Filé Mignon Suíno em Medalhão Congelado Seara 800g,22.99
2024-09-08,"Filé Mignon Selection Aprox. 1,7Kg",169.13
2024-09-08,"Filé Mignon Swift Gran Reserva Aproximadamente 1,8 Kg",160.16
2024-09-08,Filé Mignon Bovino Especial Carrefour Aproximadamente 800 g,62.71
2024-09-08,Hambúrguer de Filé Mignon Congelado Wessel 360g com 2 Unidades,21.69
2024-09-08,Ração Úmida Cesar Sachê Cortes Selecionados Sabor Filé Mignon para Cães Adultos 85 g,3.79
2024-09-08,Medalhão de Filé Mignon Aprox. 400g,31.35
2024-09-08,Bife de Filé Mignon Aprox. 500g,39.19
2024-09-08,"Contra Filé Swift Bronze Aproximadamente 1,5 Kg",55.34
2024-09-08,Contra Filé Bovino Carrefour Aproximadamente 600 g,28.61
2024-09-08,Contra Filé em Pedaços Carrefour Aproximadamente 600 g,27.47
2024-09-08,"Contra Filé Congelado Swift Aproximadamente 1,4 Kg",61.57
2024-09-08,"Contra Filé Selection Aprox. 1,3 Kg",111.14
2024-09-08,Contra Filé Bovino Resfriado 1953 Friboi,85.99
2024-09-08,Bife Contra Filé Carrefour Embalagem Familiar Aproximadamente 800 g,38.87
2024-09-08,Filé de Pescada sem Espinha Congelada Costa Sul 800g,38.99
2024-09-08,Bife de Contra Filé Aprox. 500g,25.94
2024-09-08,Alcatra com Maminha a Vácuo Carrefour Aprox. 5 Kg,181.45
2024-09-08,Bife Alcatra Carrefour Embalagem Familiar Aproximadamente 800g,29.59
2024-09-08,"Aranha de Alcatra Bovina Aprox. 1,5 Kg",44.84
2024-09-08,Alcatra Bovina Carrefour Aproximadamente 400 g,14.79
2024-09-08,Bife de Alcatra Aprox. 400g,17.47
2024-09-08,Alcatra Pedaço Carrefour Aproximadamente 600 g,23.15
2024-09-08,"Miolo de Alcatra Maturatta Aprox. 1,5 Kg",88.04
2024-09-08,"Alcatra Congelada Swift Aproximadamente 1,4 Kg",64.37
2024-09-08,Alcatra Bovina Moída Carrefour Aproximadamente 500 g,21.84
2024-09-08,"Alcatra Fracionada à Vácuo Aprox. 1,2 Kg",46.79
2024-09-08,"Maminha da Alcatra Friboi Resfriada Aprox. 1,95 Kg",99.49
2024-09-08,Alcatra Selection 1 KG,69.89
2024-09-08,"Alcatra Já Pro Forno Congelado Swift Aproximadamente 1,5 Kg",78.72
2024-09-08,Bife de Alcatra Bovina Carrefour Embalagem Familiar Aproximadamente 800 g,29.59
2024-09-08,Bife de Coxão Duro P/ Milanesa 600g,21.59
2024-09-08,Bife de Coxão Duro para Milanesa Carrefour Embalagem Familiar Aprox. 800g,25.59
2024-09-08,Bife de Patinho Bovino Carrefour Embalagem Familiar Aproximadamente 800 g,34.23
2024-09-08,Carne Moída Patinho Carrefour Aproximadamente 500g,20.84
2024-09-08,Carne Moída Resfriada de Patinho Carrefour Selection 500g,36.89
2024-09-08,Paleta Bovina à Vácuo 500g*NÃO REATIVAR-CÓDIGO DE COMPRA*,25.49
2024-09-08,Paleta Bovina Moída Congelada Swift 500 g,18.98
2024-09-08,Paleta Bovina Moída Carrefour Aproximadamente 500 g,16.89
2024-09-08,Paleta Bovina Pedaço Carrefour Aproximadamente 1 kg,27.19
2024-09-08,Músculo Pedaço Aprox. 400g,11.96
2024-09-08,Costela Minga Bovina Cong Aprox. 2kg,50.78
2024-09-08,"Costela Bovina Já Pro Forno Congelado Swift Aproximadamente 1,8 Kg",62.96
2024-09-08,"Costela Quadrada Congelado Swift Aproximadamente 2,5kg",74.95
2024-09-08,Costela Suína Serrada Refrigerado Carrefour Aprox. 800 g,22.39
2024-09-08,"Peito E Costela Bovino Reserva Congelado Friboi Reserva Aproximadamente 1,8 Kg",48.42
2024-09-08,Hambúrguer de Costela Bovina Congelado Wessel 360g com 2 Unidades,21.69
2024-09-08,Lingüiça Bovina CaraPreta Costela Congelada 300 g,21.39
2024-09-08,Hambúrguer de Costela Maturatta 180g,6.99
2024-09-08,Carré Curto Ovino Congelado Swift Aproximadamente 600 g,74.94
2024-09-08,Cupim Bovino Congelado Mais Swift Aproximadamente 1700g,83.27
2024-09-08,Iscas de Cupim Bovino Congelado Swift 500 g,29.89
2024-09-08,"Cupim Já Pro Forno Congelado Swift Aproximadamente 1,4 Kg",74.17
2024-09-08,Hambúrguer de Fraldinha Maturatta 180g,6.99
2024-09-08,Hambúrguer de Fraldinha Congelado Wessel 360g com 2 Unidades,21.69
2024-09-08,Peça Fraldinha Bovina Resfriada Wessel 800g,139.9
2024-09-08,"Peça de Fraldinha Bovina Resfriada Maturatta Aprox. 1,5 Kg",91.49
2024-09-08,"Feijão Fradinho Seco Tipo 1, 5 Estrelas, 1kg",18.89
2024-09-08,Feijão Fradinho 5 Estrelas 1kg,9.99
2024-09-08,Feijão Fradinho Cozido no Vapor Caldo Bom 250g,13.59
2024-09-08,Maminha Swift Bronze Kg,35.89
2024-09-08,"Maminha Hereford Aprox. 1,2 Kg",131.88
2024-09-08,"Maminha Já Pro Forno Congelado Swift Aproximadamente 1,7 Kg",96.73
2024-09-08,Maminha Bovina Carrefour Aproximadamente 1 kg,36.99
2024-09-08,Bife de Maminha Aprox. 400g,17.47
2024-09-08,Farinha Láctea NESTLÉ Tradicional 600g,17.19
2024-09-08,Farinha de Milho Flocão Yoki Kimilho 500g,5.29
2024-09-08,Farinha Trigo Carrefour Classic Pp 1kg,4.89
2024-09-08,Farinha de Trigo Tradicional Dona Benta 1kg,5.49
2024-09-08,Farinha de Trigo Rosa Branca Especial 1Kg,4.79
2024-09-08,Vinho Tinto Português Vinha da Casinha Garrafa 750ml,39.99
2024-09-08,Farinha de Milho Flocos Yoki Kimilho 500g,5.39
2024-09-08,Farinha de Aveia Integral Carrefour Viver 170 g,3.29
2024-09-08,Frango a Passarinho IQF Lar 700g,9.99
2024-09-08,Frango a Passarinho Seara IQF 1Kg,15.99
2024-09-08,Farinha de Milho Amarela Yoki 500g,6.59
2024-09-08,Farinha Láctea NESTLÉ Tradicional 210g,7.89
2024-09-08,Acém e Pescoço Bovino Reserva Congelado Kg,26.9
2024-09-08,Acém Bovina Carrefour Aproximadamente 900 g,26.09
2024-09-08,Acém Bovina Moída Resfriado Carrefour 500 g,22.69
2024-09-08,Acém Bovina Moída Resfriada Carrefour 500 g,25.99
2024-09-08,"Lagarto Swift Mais Aprox. 1,5Kg",49.47
2024-09-08,"Lagarto em Pedaços Carrefour Aproximadamente 1,100 Kg",32.99
2024-09-08,Carpaccio de Lagarto Congelado Wessel 200g,25.19
2024-09-08,Carpaccio de Carne Bovina Lagarto Congelado Carapreta 200 g,29.89
2024-09-08,Kit 2 Difusores de Aromas Safira Lavanda Secar Preciosidades 100ml Cada Grátis 1 Home Spray Passion Fine Collection 120ml,43.29
2024-09-08,Pernil Suíno Temperado Sem Osso Congelado Swift Aproximadamente 900g,19.78
2024-09-08,Pernil Suíno à Pururuca Pedaço Sabor & Qualidade Aprox. 1 Kg,23.98
2024-09-08,Pernil Suíno Temperado Congelado Confiare Aprox. 3Kg,74.94
2024-09-08,Pernil Suíno Assa Fácil Swift Aprox. 800g,23.98
2024-09-08,Linguiça de Pernil com Alho Sabor de Bragança Blíster 1Kg,29.9
2024-09-08,Linguiça de Pernil Perdigão Na Brasa 1Kg,29.19
2024-09-08,Linguiça de Pernil Swift 700 g,19.0
2024-09-08,Linguiça Suína de Pernil Gran Corte Gran Fogaça 400g,20.39
2024-09-08,Linguiça Pernil Pimenta Biquinho Swift 500 g,18.98
2024-09-08,Linguiça Pernil com Alho Swift 500 g,18.98
2024-09-08,Bife de Pernil Suíno Sabor & Qualidade Aprox. 600g,10.78
2024-09-08,Cubos de Pernil Suíno Congelado Swift 500 g,14.5
2024-09-08,Costela Suína Temperada Churrasco Seara Aprox. 880g,29.82
2024-09-08,Costela Suína Temperada Aprox. 900g,27.35
2024-09-08,Costela Suína à Pururuca Sabor & Qualidade Aprox. 800g,16.78
2024-09-08,Costela Suína Temperada Congelada Swift Aproximadamente 800 g,19.98
2024-09-08,Costela Suína Congelada Aprox. 800g,26.31
2024-09-08,Calabresa Apimentada Biquinho Spirale Rei Da Linguiça 400 g,19.39
2024-09-08,Linguiça Calabresa Inteira Aurora Aproximadamente 300 g,11.06
2024-09-08,Lingüiça de Calabresa Defumada Perdigão Aprox. 500g,13.95
2024-09-08,Linguiça Tipo Calabresa Enroladinha Perdigão 500g,19.29
2024-09-08,Lingüiça de Calabresa Defumada Aurora Aprox. 450g,16.37
2024-09-08,Linguiça Calabresa Aurora 400 g,22.39
2024-09-08,Linguiça Calabresa Prieto 500 g,24.59
2024-09-08,Linguiça Toscana Perdigão Na Brasa 1 Kg,28.9
2024-09-08,Linguiça Toscana Perdigão Na Brasa Apimentada 1Kg,28.9
2024-09-08,Linguiça Toscana com Queijo Perdigão Na Brasa 600 g,35.49
2024-09-08,Linguiça Toscana Perdigão Na Brasa Aproximadamente 600 g,19.43
2024-09-08,Linguiça Toscana com Alho e Ervas Perdigão Na Brasa 600g,27.19
2024-09-08,Linguiça Toscana com Pimenta Biquinho Perdigão Na Brasa 600g,35.49
2024-09-08,Linguiça de Frango com Bacon Perdigão Na Brasa 600g,27.19
2024-09-08,Linguiça Fina  Na Brasa Perdigão 400g,22.49
2024-09-08,"Coca-Cola Sem Açucar 1,5L + Linguiça Perdigão Na Brasa com queijo 600g",40.78
2024-09-08,Fanta Laranja Pet 2L + Linguiça de Frango com Bacon Perdigão Na Brasa 600g,41.28
2024-09-08,Fanta Guaraná Pet 2L + Linguiça Toscana com Alho e Ervas Perdigão Na Brasa 600g,40.18
2024-09-08,Lingüiça Toscana Grossa Auora Aprox. 700g,13.93
2024-09-08,Linguiça Toscana Sabor Cerveja e Cebola Aurora Premium 500g,27.99
2024-09-08,Linguiça Toscana Seara 700g,23.49
2024-09-08,Bacon Fatiado Defumado Sadia 250g,22.39
2024-09-08,Bacon Sadia Pedaços Aprox 250 g,10.99
2024-09-08,Macarrão com Bacon Carbonara Sadia Hot Bowls 300g,11.49
2024-09-08,Hambúrguer Bacon Sadia 14g,8.39
2024-09-08,"Macarrão ao Molho Branco com Queijo, Brócolis e Bacon Sadia Hot Bowls 300g",11.49
2024-09-08,Linguiça Fininha Defumada Aurora 220 g,9.49
2024-09-08,Linguiça Fininha Apimentada Aurora Premium 600g,28.09
2024-09-08,Linguiça Lombo com Alho e Ervas Aurora Premium 500g,27.99
2024-09-08,Leite Semidesnatado UHT Tipo A2A2 Piracanjuba 1L,6.49
2024-09-08,Leite em Pó Piracanjuba Integral Instantâneo 400g,16.39
2024-09-08,Leite em Pó Piracanjuba Integral Pouch 800g,42.49
2024-09-08,Leite em Pó Piracanjuba Integral 400g,19.99
2024-09-08,Kit Leite Condensado Semidesnatado Piracanjuba 395g 6 Unidades,43.99
2024-09-08,Composto Lácteo Ninho Fases 1+ 800g 2 Unidades,84.94
2024-09-08,Pipoca Pronta Doce Leite em Pó Ninho Pipó Gourmet 100g,13.99
2024-09-08,Kit Leite Integral UHT Ninho Forti+ Vitaminado 1 L 6 Unidades,46.19
2024-09-08,Manteiga Extra com Sal Président Gastronomique 380g,25.89
2024-09-08,Manteiga Extra sem Sal Président Gastronomique 200 g,14.49
2024-09-08,Manteiga Extra com Sal Président Gastronomique Pote 200 g,14.49
2024-09-08,Queijo Prato Fatiado Light sem Lactose Tirolez 150g,17.59
2024-09-08,Queijo Prato Esférico Aprox. 200g,17.78
2024-09-08,Queijo Prato Light Tirolez Fatiado 150 g,18.79
2024-09-08,Queijo Minas Frescal Estrela de Minas Aproximadamente 540 g,26.45
2024-09-08,Queijo Minas Frescal Fazenda Bela Vista Aproximadamente 540 g,32.71
2024-09-08,Queijo Minas Padrão Light Verde Campo Aproximadamente 450 g,42.29
2024-09-08,Queijo Minas Artesanal Carrefour Aproximadamente 200 g,14.47
2024-09-08,Queijo Minas Frescal Danubio 250g,19.29
2024-09-08,Queijo Minas Frescal Vegano de Castanha de Caju Vida Veg 200g,27.49
2024-09-08,Queijo Minas Padrão Lacfree Aproximadamente 450 g,49.45
2024-09-08,Queijo Mussarela Recheada Vertente Minas Aproximadamente 200 g,15.69
2024-09-08,Queijo Minas Frescal Ipanema Aproximadamente 540 g,31.85
2024-09-08,Queijo Azul de Minas Damasco Cruzilia Aprox. 200 g,31.98
2024-09-08,Queijo Minas Fescal Monteminas Aproximadamente 540 g,28.99
2024-09-08,Queijo Minas Artesanal Araxá Aprox 400g,43.16
2024-09-08,"Queijo Minas Frescal Peça Sol Brilhante Aproximadamente 1,5 kg",83.84
2024-09-08,Queijo Minas Artesanal São Pedro Aprox 450g,48.55
2024-09-08,Queijo Minas Curado Fracionado Dummont Aproximadamente 540 g,38.65
2024-09-08,Queijo Azul de Minas Cruzilia Aprox 170g,21.23
2024-09-08,Requeijão Cremoso Cebola Caramelizada Catupiry 180g,9.49
2024-09-08,Requeijão Cremoso Catupiry Pimenta Biquinho com 180 g,9.49
2024-09-08,Requeijão Cremoso Original Catupiry 410g,35.99
2024-09-08,Requeijão Cremoso Ervas Finas Catupiry Copo 180 g,10.09
2024-09-08,Requeijão Cremoso Azeitona Preta Catupiry Copo 180 g,10.09
2024-09-08,Requeijão Cremoso Catupiry Light Pote 420 g,18.99
2024-09-08,Mini Coxinha de Frango com Requeijão Catupiry 300g,24.99
2024-09-08,Mini Kibe com Requeijão Catupiry 300g,21.99
2024-09-08,Requeijão Cremoso Catupiry Tradicional Pote 420 g,18.99
2024-09-08,"Iogurte Grego Semidesnatado Light Nestlé Tradicional, Maracujá e Morango 540g",13.99
2024-09-08,Iogurte Desnatado Nestlé Tradicional 170g,2.79
2024-09-08,"Iogurte Integral Nestlé Cenoura, Mel e Laranja 170g",2.79
2024-09-08,Iogurte Semidesnatado Nestlé Ninho Soleil Maçã e Banana 170g,3.19
2024-09-08,"Iogurte Nestlé de Morango 1,25Kg",14.49
2024-09-08,Iogurte Grego Nestlé Tradicional + Morango 540g 6 Unidades Leve Mais Pague Menos,13.99
2024-09-08,Iogurte Integral Nestlé Mel 170g,2.79
2024-09-08,Iogurte Semi Desnatado Nestlé Chamyto Morango 100g,3.89
2024-09-08,Iogurte Nestlé de Morango 170g,2.89
2024-09-08,Iogurte Grego Light Nestlé Morango 360g,10.49
2024-09-08,Iogurte Grego Light Nestlé Maracujá 360g,10.49
2024-09-08,Iogurte Nestlé Morango 510g 6 Unidades,7.89
2024-09-08,Iogurte Semidesnatado Nestlé Ninho Morango 170g,3.19
2024-09-08,"Iogurte Nestlé de Vitamina de Frutas 1,25Kg",14.49
2024-09-08,Iogurte Grego Nestlé Frutas Vermelhas 360g 4 Unidades,11.49
2024-09-08,Iogurte Granola com Castanhas e Amêndoas  Mix Vigor Viv Pote 140g,3.79
2024-09-08,Iogurte Grego Nestlé Torta de Maracujá 90 g,2.59
2024-09-08,Iogurte Integral Grego com Calda de Coco Nestlé 90g,2.59
2024-09-08,Iogurte Natural Mel Nestlé 340g,7.39
2024-09-08,"Iogurte Desnatado Mel Zero Lactose Batavo Pense Zero Garrafa 1,15 Kg Embalagem Econômica",13.2
2024-09-08,Iogurte Grego Batavo Pense Zero Tradicional 100g,2.29
2024-09-08,Iogurte à Base de Leite Desnatado Batavo Natural 170g 1 Unidade,2.79
2024-09-08,Iogurte Batavo Pense Zero Pedaços de Morango 500g,8.99
2024-09-08,Iogurte Grego Desnatado Batavo de Morango 500g,8.99
2024-09-08,Iogurte Grego Desnatado Batavo Tradicional 100g,2.39
2024-09-08,Iogurte Integral Batavo Pedaços Morango 500g,9.79
2024-09-08,Iogurte de Morango Com Cereais Bob Esponja Batavo 120g,3.65
2024-09-08,Iogurte Semidesnatado de Morango Paw Patrol Batavinho 110 g,3.65
2024-09-08,Iogurte Integral Batavo Pedaços Pêssego 500g,9.79
2024-09-08,Iogurte Semidesnatado Jabuticaba Batavo 170 g,2.49
2024-09-08,Iogurte Integral Batavo Pedaços Coco 500g,9.79
2024-09-08,Iogurte Semidesnatado de Graviola Batavo 170 g,2.49
2024-09-08,Iogurte Batido Danone Aveia 800g,11.81
2024-09-08,Iogurte Vigor Parcialmente Desnatado Adoçado Batido Garrafa 800 g,12.39
2024-09-08,Iogurte Batido Vigor Frasco 170 g,1.99
2024-09-08,Leite Condensado MOÇA Zero Lactose Caixinha 395g,13.19
2024-09-08,"Sorvete de Creme Nestlé 1,5 Litros",19.89
2024-09-08,LEITE EM PÓ MOLICO DESNATADO LATA 280g,26.99
2024-09-08,LEITE EM PÓ MOLICO DESNATADO Sachet 500g,31.99
2024-09-08,Chocolate NESTLÉ CLASSIC ao Leite 25g,3.39
2024-09-08,Chocolate NESTLÉ CLASSIC ao Leite 150g,11.9
2024-09-08,Chocolate ao Leite NESTLÉ CLASSIC Tablete 80g,8.9
2024-09-08,Chocolate NESTLÉ CLASSIC ao Leite com Amendoim 150g,10.3
2024-09-08,"Coxão Mole Fracionado à Vácuo Aprox. 1,3 Kg",55.89
2024-09-08,Coxão Mole Carrefour Aproximadamente 600 g,21.59
2024-09-08,Coxão Mole para Strogonoff Aprox. 400g,16.39
2024-09-08,Bife de Coxão Mole Carrefour Embalagem Familiar Aproximadamente 800 g,31.19
2024-09-08,Carne Moída Coxão Mole Carrefour Aprox. 500g,20.49
2024-09-08,Bife de Coxão Mole Aprox. 400g,16.39
2024-09-08,Brochete de Coxão Mole Aprox. 400g,16.39
2024-09-08,Ração Úmida Cesar Sachê Cortes Selecionados Sabor Carne Assada ao Molho para Cães Adultos 85 g,3.79
2024-09-08,Coxa com Sobrecoxa Assada Carrefour kg,25.9
2024-09-08,Pizza Assada Portuguesa 800 g,12591.0
2024-09-08,Filé de Tilápia Congelado Carrefour Special Sabor & Qualidade 250g,17.9
2024-09-08,Filé de Merluza Congelado Planalto 500 g,23.79
2024-09-08,Filé de Salmão com Pele Resfriado Carrefour Aprox. 900g,80.99
